"module","trait","cor","n_gene","hub_gene","GO","GO_padj"
"blue","herv_HERV17.int; herv_HERVL.int; herv_HERVK22.int; herv_HERVK9.int; herv_HERVH.int; AD_binary; herv_HERVK14.int; herv_HERVK.int; herv_HERVK3.int; herv_HERV3.int; herv_HERVK11.int; herv_HERVE.int; herv_HERV.Fc1.int; herv_HERVK13.int","0.127; 0.115; 0.096; 0.086; 0.069; -0.061; 0.061; 0.04; 0.035; 0.027; 0.014; -0.014; 0.007; 0.001",760,"DLC1; PRKG1; SLC19A1; EPS8; ATP1A2; SLC6A12; GPC5; SGIP1; PDE7B; HTR1F; PDGFRB; GRM8; SLC38A11; ARHGAP42; CALD1; LAMA2; PTH1R; NR2F2-AS1; COLEC12; GRM3; SLC30A10; NOTCH3; SLC6A1; RORA; ZFHX3; RNF152; PLXDC1; ARHGAP10; PCBP3; TFPI","circulatory system process; blood circulation; cyclic nucleotide metabolic process; cyclic purine nucleotide metabolic process; renal system development; metal ion transport; sodium ion transmembrane transport; kidney development; potassium ion import across plasma membrane; inorganic cation import across plasma membrane; inorganic ion import across plasma membrane; muscle contraction; vascular process in circulatory system; sodium ion transport; nephron development; circadian regulation of gene expression; inorganic cation transmembrane transport; circadian rhythm; inorganic ion transmembrane transport; muscle system process; monoatomic cation transmembrane transport; renal tubule development; enzyme-linked receptor protein signaling pathway; cell-matrix adhesion; actin filament-based process; adenylate cyclase-inhibiting G protein-coupled receptor signaling pathway; monoatomic ion transmembrane transport; G protein-coupled receptor signaling pathway; sensory organ development; nephron tubule development","5.19148936519325e-05; 5.81866227198369e-05; 0.000259046610278576; 0.000259046610278576; 0.00137114004820228; 0.00519155249910759; 0.00519155249910759; 0.00614811469725747; 0.00694089714112461; 0.00694089714112461; 0.00694089714112461; 0.00694089714112461; 0.00694089714112461; 0.00757809675427575; 0.00776133315637094; 0.0117923848615842; 0.0117923848615842; 0.012786943248576; 0.0129841456510296; 0.0129841456510296; 0.0129841456510296; 0.0129841456510296; 0.0132890889229752; 0.0151935357206801; 0.0151935357206801; 0.0172319710328365; 0.0172319710328365; 0.0184231727471683; 0.0186070590504281; 0.0197164869067121"
"red","herv_HERV17.int; herv_HERVL.int; herv_HERVK3.int; herv_HERVK9.int; herv_HERVK22.int; herv_HERVH.int; herv_HERV3.int; AD_binary; herv_HERV.Fc1.int; herv_HERVK11.int; herv_HERVE.int; herv_HERVK.int; herv_HERVK14.int; herv_HERVK13.int","0.075; 0.06; 0.057; 0.054; 0.05; 0.041; 0.029; 0.025; -0.018; -0.017; -0.016; -0.008; 0.007; 0.005",72,"RGS5; SPARCL1; RHOB; MGLL; CD81; TNS1; TMBIM6; CYBA; EMP3; TSC22D3; BCAM; COBLL1; EFHD1; EIF4EBP2; JAK1; NDUFB7; TRIB2; DDIT4; COX6B1; CPT1A; MXRA7; JADE1; NDUFA1; RHOQ; TNFRSF1B; ATP5F1D; NDUFA3; WAC; ADAM17; ISG15","proton motive force-driven ATP synthesis; aerobic respiration; oxidative phosphorylation; ATP biosynthetic process; cellular respiration; proton motive force-driven mitochondrial ATP synthesis; proton transmembrane transport; ribonucleoside triphosphate biosynthetic process; purine ribonucleoside triphosphate biosynthetic process; energy derivation by oxidation of organic compounds; purine nucleoside triphosphate biosynthetic process; triglyceride metabolic process; nucleoside triphosphate biosynthetic process; purine ribonucleoside triphosphate metabolic process; nucleoside phosphate biosynthetic process; ribonucleoside triphosphate metabolic process; purine nucleoside triphosphate metabolic process; generation of precursor metabolites and energy; nucleoside triphosphate metabolic process; aerobic electron transport chain; neutral lipid metabolic process; acylglycerol metabolic process; ATP synthesis coupled electron transport; mitochondrial ATP synthesis coupled electron transport; purine ribonucleotide biosynthetic process; ATP metabolic process; purine-containing compound biosynthetic process; ribonucleotide biosynthetic process; ribose phosphate biosynthetic process; purine nucleotide biosynthetic process","0.00493916656975429; 0.00493916656975429; 0.00493916656975429; 0.00698942806309433; 0.00698942806309433; 0.00698942806309433; 0.00698942806309433; 0.00698942806309433; 0.00698942806309433; 0.00698942806309433; 0.00698942806309433; 0.00698942806309433; 0.00724220449377791; 0.00849482111750782; 0.00849482111750782; 0.00855824762651318; 0.00927813534005586; 0.00951215424412307; 0.00953071431802135; 0.0123130877657492; 0.0127992782849669; 0.0127992782849669; 0.0151556161393844; 0.0151556161393844; 0.0161057473843107; 0.016914404514964; 0.0171464497100643; 0.0171464497100643; 0.0180340419651677; 0.0282481860549736"
"brown","AD_binary; herv_HERVH.int; herv_HERVL.int; herv_HERVK11.int; herv_HERV3.int; herv_HERVK14.int; herv_HERVK.int; herv_HERVE.int; herv_HERVK9.int; herv_HERVK3.int; herv_HERVK22.int; herv_HERVK13.int; herv_HERV17.int; herv_HERV.Fc1.int","0.099; 0.074; 0.059; 0.041; 0.039; 0.032; 0.031; 0.025; 0.024; 0.023; 0.022; -0.013; -0.013; -0.005",500,"KCNIP4; CADM2; LSAMP; NRXN1; PCDH9; CSMD1; PTPRD; RBFOX1; LRP1B; OPCML; LRRTM4; NRG3; FGF14; RALYL; CNTNAP2; DPP10; SYT1; NAV3; SNTG1; NRXN3; NEGR1; KCNQ5; NKAIN2; CTNNA2; TENM2; NCAM2; ANKS1B; ADGRB3; IL1RAPL1; MARCHF1","neuron development; trans-synaptic signaling; synaptic signaling; chemical synaptic transmission; anterograde trans-synaptic signaling; neuron projection development; neuron projection morphogenesis; modulation of chemical synaptic transmission; regulation of trans-synaptic signaling; plasma membrane bounded cell projection morphogenesis; cell projection morphogenesis; cell morphogenesis involved in neuron differentiation; regulation of plasma membrane bounded cell projection organization; synapse organization; cell-cell adhesion via plasma-membrane adhesion molecules; cell-cell signaling; regulation of cell projection organization; positive regulation of synapse assembly; synapse assembly; regulation of neuron projection development; regulation of synapse organization; regulation of postsynaptic membrane potential; regulation of synapse structure or activity; cell junction organization; cell morphogenesis; regulation of synapse assembly; axon development; axonogenesis; regulation of membrane potential; presynapse organization","2.15579016625704e-15; 4.07667738703058e-14; 5.58997537837681e-14; 1.28797062777708e-13; 1.28797062777708e-13; 3.61579154703252e-13; 1.37213906602207e-11; 1.60028900627401e-11; 1.60028900627401e-11; 4.34095988223515e-11; 5.6901845514321e-11; 4.23286486848525e-10; 1.7564239947334e-08; 2.13384080719694e-08; 4.65755264676621e-08; 4.65755264676621e-08; 4.65755264676621e-08; 4.74733759277723e-08; 6.6002849514958e-08; 7.04082773652178e-08; 1.27673385103514e-07; 1.4655683048787e-07; 1.4655683048787e-07; 3.99264208860638e-07; 6.12477491291989e-07; 7.97889386703215e-07; 9.19356876747074e-07; 2.4460208908246e-06; 3.55439415947707e-06; 1.04964831297478e-05"
"turquoise","AD_binary; herv_HERVK3.int; herv_HERV3.int; herv_HERVH.int; herv_HERVK.int; herv_HERV17.int; herv_HERV.Fc1.int; herv_HERVK11.int; herv_HERVK22.int; herv_HERVK14.int; herv_HERVL.int; herv_HERVK9.int; herv_HERVE.int; herv_HERVK13.int","0.136; 0.065; 0.054; 0.046; -0.041; -0.033; -0.019; -0.018; 0.017; -0.013; 0.011; 0.011; 0.003; -0.001",953,"FLT1; CLDN5; ELOVL7; ABCB1; HERC2P3; VWF; ST6GALNAC3; SLC7A5; EGFL7; PODXL; ATP10A; MECOM; PTPRB; SLC7A1; SLCO4A1; ANO2; DOCK9; TGM2; MT2A; HLA-E; TMSB10; FLI1; GALNT18; PECAM1; ADGRL4; SLC2A1; ITM2A; ADIPOR2; SLC16A1; ID1","cytoplasmic translation; cell adhesion; regulation of cell adhesion; locomotion; regulation of locomotion; blood vessel morphogenesis; vasculature development; regulation of cell motility; regulation of cell migration; blood vessel development; positive regulation of cell motility; positive regulation of locomotion; positive regulation of cell migration; angiogenesis; positive regulation of cell adhesion; tube morphogenesis; epithelial cell differentiation; endothelium development; enzyme-linked receptor protein signaling pathway; cell activation; tube development; endothelial cell differentiation; positive regulation of cell population proliferation; cell surface receptor protein tyrosine kinase signaling pathway; biological process involved in interspecies interaction between organisms; anatomical structure formation involved in morphogenesis; small GTPase-mediated signal transduction; leukocyte activation; cell-cell adhesion; immune response","2.18181947164303e-11; 1.65976812453195e-10; 2.04819235022866e-09; 2.12183034043288e-09; 2.45971342161124e-09; 3.69391414405942e-09; 3.69391414405942e-09; 5.06088295178272e-09; 8.78906827939614e-09; 8.78906827939614e-09; 7.46329699429122e-08; 7.46329699429122e-08; 9.08379757807929e-08; 9.1378721174661e-08; 6.54320745456644e-07; 7.04750396968088e-07; 8.73174987109835e-07; 1.07782118217173e-06; 9.80351299073938e-06; 1.5804444011205e-05; 1.61266229023421e-05; 1.67817178799581e-05; 1.67817178799581e-05; 1.87864442469283e-05; 1.87864442469283e-05; 2.17444990432497e-05; 2.30869763339487e-05; 2.40601673611977e-05; 2.80584840137508e-05; 4.60894850889333e-05"
"yellow","herv_HERVL.int; herv_HERVH.int; herv_HERV17.int; herv_HERVK22.int; herv_HERVK9.int; herv_HERVK3.int; herv_HERV3.int; herv_HERVK14.int; herv_HERVK.int; herv_HERV.Fc1.int; herv_HERVE.int; herv_HERVK13.int; herv_HERVK11.int; AD_binary","0.144; 0.129; 0.105; 0.102; 0.098; 0.087; 0.079; 0.069; 0.045; -0.014; -0.013; 0.013; 0.011; 0.007",299,"IGFBP7; ARHGAP29; SPARC; RHOJ; RB1; FN1; N4BP2L2; MTUS1; HNRNPA2B1; BTG1; C2CD2; ETS1; PTMS; ECE1; CAMK2D; SIPA1L2; LGALS1; ARHGAP26; RUFY3; PDS5B; SMIM3; TBX3; SEM1; RALGAPB; STAG2; STAG1; CD151; ZNF207; ADAMTS9; DNAJC15","sister chromatid segregation; mitotic sister chromatid segregation; sister chromatid cohesion; chromosome segregation; nuclear chromosome segregation; chromosome condensation; regulation of intracellular transport; mitotic sister chromatid cohesion; DNA repair; oxidative phosphorylation; mitotic nuclear division; DNA metabolic process; aerobic respiration; nuclear division; tRNA modification; late endosome to lysosome transport; generation of precursor metabolites and energy; energy derivation by oxidation of organic compounds; mRNA export from nucleus; organelle inheritance; Golgi inheritance; regulation of early endosome to late endosome transport; chromosome separation; RNA export from nucleus; RNA modification; autophagy; process utilizing autophagic mechanism; positive regulation of autophagy; chromosome organization; mitotic sister chromatid separation","0.0919647489090024; 0.0919647489090024; 0.107285831811753; 0.11086806776489; 0.218170188749726; 0.220205016131199; 0.220205016131199; 0.257538605807776; 0.324706934754007; 0.324706934754007; 0.324706934754007; 0.324706934754007; 0.328388411065478; 0.398298237242115; 0.398298237242115; 0.398298237242115; 0.402353498685916; 0.414287891753965; 0.423024328031237; 0.427063322903381; 0.427063322903381; 0.427063322903381; 0.427063322903381; 0.427063322903381; 0.460195175480488; 0.460195175480488; 0.460195175480488; 0.462096830734374; 0.468542688239221; 0.469812600314624"
"green","AD_binary; herv_HERVH.int; herv_HERVK3.int; herv_HERVL.int; herv_HERVK22.int; herv_HERVK13.int; herv_HERV3.int; herv_HERVK9.int; herv_HERVK.int; herv_HERVK11.int; herv_HERVK14.int; herv_HERV.Fc1.int; herv_HERV17.int; herv_HERVE.int","0.127; 0.056; 0.043; 0.04; 0.038; -0.036; 0.035; 0.02; -0.019; 0.014; 0.011; -0.009; -0.006; -0.005",81,"HSPA1A; HSP90AA1; HSPB1; HSPH1; DNAJB1; HSP90AB1; ANKRD37; HSPD1; SERPINH1; DNAJA1; FKBP4; SELENOW; HSPA8; UBB; PTGES3; RPS15; ZFP36L1; CHORDC1; HSPA5; CACYBP; OST4; STIP1; FXR1; HSPA4L; HNRNPH1; P4HA1; CARHSP1; SQSTM1; HSPA4; PAPOLA","protein folding; chaperone-mediated protein folding; protein maturation; 'de novo' protein folding; 'de novo' post-translational protein folding; response to unfolded protein; response to topologically incorrect protein; protein refolding; chaperone cofactor-dependent protein refolding; response to heat; response to temperature stimulus; regulation of protein stability; protein stabilization; positive regulation of telomere maintenance via telomerase; positive regulation of telomere maintenance via telomere lengthening; cellular response to heat; RNA-templated DNA biosynthetic process; telomere maintenance via telomerase; telomere maintenance via telomere lengthening; positive regulation of DNA biosynthetic process; regulation of telomere maintenance via telomerase; regulation of telomere maintenance via telomere lengthening; positive regulation of telomere maintenance; regulation of protein ubiquitination; regulation of DNA biosynthetic process; telomere maintenance; DNA biosynthetic process; establishment of protein localization to organelle; telomere organization; regulation of protein modification by small protein conjugation or removal","1.39254727806586e-20; 5.81768263824578e-17; 1.13858854640254e-16; 1.35114664244267e-14; 4.53721646652886e-13; 1.57002509432583e-10; 6.21262106444082e-10; 3.12526225108043e-08; 3.12526225108043e-08; 8.28845663369267e-08; 5.24768681565957e-07; 6.35689226591868e-06; 1.47371857287231e-05; 2.93704806502209e-05; 5.58048836487409e-05; 5.79121883282135e-05; 9.8990988416742e-05; 9.8990988416742e-05; 0.000139972227661917; 0.000179517588301072; 0.000350162812810288; 0.000513651758104299; 0.00073111548735576; 0.00127651336514907; 0.00342302197209486; 0.00342302197209486; 0.00342302197209486; 0.00363876458977949; 0.00469844162410514; 0.00469844162410514"
"black","AD_binary; herv_HERVH.int; herv_HERVK3.int; herv_HERVK22.int; herv_HERV3.int; herv_HERVL.int; herv_HERVK.int; herv_HERV17.int; herv_HERV.Fc1.int; herv_HERVK13.int; herv_HERVK9.int; herv_HERVK11.int; herv_HERVE.int; herv_HERVK14.int","0.079; 0.065; 0.064; 0.048; 0.04; 0.033; -0.032; 0.023; -0.018; -0.014; 0.013; -0.011; -0.006; -0.006",71,"GAPDH; CD63; GNG11; GSTP1; RPS7; ATP5F1E; VAMP5; RPS5; CSTB; SRP14; EVA1B; ENSG00000268756; RABAC1; UBL5; NACA; SERINC1; SERINC3; PCBP1; NDUFB2; TUBB4B; HSP90B1; NDUFS6; CYSTM1; H2AZ1; RBM17; BTF3; DAD1; PCBP2; PSMA7; NDUFS5","SRP-dependent cotranslational protein targeting to membrane; protein localization to endoplasmic reticulum; proton motive force-driven mitochondrial ATP synthesis; cotranslational protein targeting to membrane; proton motive force-driven ATP synthesis; regulation of leukocyte proliferation; regulation of striated muscle tissue development; regulation of muscle organ development; regulation of muscle tissue development; negative regulation of peptidase activity; protein targeting to ER; ATP biosynthetic process; establishment of protein localization to membrane; mitochondrial electron transport, NADH to ubiquinone; tissue regeneration; protein targeting to membrane; ribonucleoside triphosphate biosynthetic process; purine ribonucleoside triphosphate biosynthetic process; purine nucleoside triphosphate biosynthetic process; nucleoside triphosphate biosynthetic process; negative regulation of catalytic activity; negative regulation of leukocyte proliferation; establishment of protein localization to endoplasmic reticulum; regulation of lymphocyte proliferation; negative regulation of intracellular transport; oxidative phosphorylation; regulation of mononuclear cell proliferation; leukocyte proliferation; protein localization to organelle; negative regulation of hydrolase activity","0.287128656033651; 0.287128656033651; 0.301869630857808; 0.351231527949743; 0.351231527949743; 0.367710091004563; 0.367710091004563; 0.367710091004563; 0.367710091004563; 0.376928085426618; 0.376928085426618; 0.376928085426618; 0.376928085426618; 0.376928085426618; 0.376928085426618; 0.376928085426618; 0.376928085426618; 0.376928085426618; 0.376928085426618; 0.376928085426618; 0.376928085426618; 0.376928085426618; 0.376928085426618; 0.418717091796796; 0.418717091796796; 0.418717091796796; 0.418717091796796; 0.418717091796796; 0.418717091796796; 0.418717091796796"
