"module","trait","cor","n_gene","hub_gene","GO","GO_padj"
"blue","AD_binary; herv_HERVI; herv_HERVP; herv_ERV3; herv_ERV1; herv_HERVL; herv_ERVL; herv_HERVW; herv_HERVK; herv_HERVH; herv_HERVF; herv_HERVS; herv_HERVE","-0.115; -0.074; -0.072; -0.065; 0.061; -0.051; -0.046; -0.04; -0.032; 0.028; 0.009; 0.007; -0.005",203,"FTH1; CRYAB; FTL; CNP; APOD; ACTB; PTMA; CLDND1; CSRP1; RNASE1; MT3; NKX6-2; OLIG1; SELENOP; MARCKSL1; PPP1R14A; GAPDH; RPLP1; NICOL1; HSPA2; FAU; RPL18; APLP1; JUND; CD81; H3-3B; SPP1; UBB; EIF1; CBR1","cytoplasmic translation; proton transmembrane transport; monoatomic cation transport; inorganic cation transmembrane transport; monoatomic cation transmembrane transport; inorganic ion transmembrane transport; translation; oxidative phosphorylation; purine nucleoside triphosphate metabolic process; monoatomic ion transport; purine ribonucleoside triphosphate biosynthetic process; nucleoside triphosphate metabolic process; purine nucleoside triphosphate biosynthetic process; ribonucleoside triphosphate biosynthetic process; proton motive force-driven ATP synthesis; purine ribonucleoside triphosphate metabolic process; ATP metabolic process; nucleoside triphosphate biosynthetic process; ribonucleoside triphosphate metabolic process; ATP biosynthetic process; monoatomic ion transmembrane transport; proton motive force-driven mitochondrial ATP synthesis; purine ribonucleotide biosynthetic process; ribonucleotide biosynthetic process; ribose phosphate biosynthetic process; purine ribonucleotide metabolic process; purine nucleotide biosynthetic process; aerobic respiration; ribonucleotide metabolic process; ribose phosphate metabolic process","2.90750129991674e-14; 4.96244934304493e-07; 5.3951570067103e-07; 1.83859054854254e-06; 2.96308826388789e-06; 5.38932756820075e-06; 6.92598567066215e-06; 7.49168873417174e-06; 7.76272325326149e-06; 7.85519380138382e-06; 7.88303225465578e-06; 8.28675175751503e-06; 8.28675175751503e-06; 8.28675175751503e-06; 8.28675175751503e-06; 1.12755442086335e-05; 1.24994612611823e-05; 1.3420428057556e-05; 1.37575221396684e-05; 1.86192775424092e-05; 1.88398353990432e-05; 2.30007422120059e-05; 3.16330368766931e-05; 4.91407615358724e-05; 7.46051989322861e-05; 9.26185138533789e-05; 0.000105356095573905; 0.000105356095573905; 0.000142047366478281; 0.000177802768702045"
"turquoise","herv_ERVL; herv_HERVI; herv_ERV3; herv_HERVL; herv_HERVK; herv_HERVW; herv_HERVP; herv_HERVH; herv_HERVS; herv_HERVE; herv_HERVF; AD_binary; herv_ERV1","0.272; 0.27; 0.238; 0.23; 0.228; 0.182; 0.15; 0.087; 0.058; 0.043; 0.035; 0.02; 0.014",1407,"LINC00609; PCSK6; SYNJ2; CHN2; MVB12B; DSCAML1; TMEM63A; RASGRF2; FA2H; OTUD7A; SNX29; PXK; MYO1D; SEMA4D; SLC25A13; SLC5A11; SLC39A11; RNF130; POLR2F; FNBP1; DIP2C; MICAL3; GSN; MYO1E; DPYSL5; SH3GL3; AGPAT4; PPP1R12B; PIK3C2B; SLC13A3","regulation of small GTPase mediated signal transduction; interleukin-8 production; regulation of interleukin-8 production; negative regulation of signal transduction; morphogenesis of embryonic epithelium; epithelial tube formation; tube formation; neural tube closure; primary neural tube formation; tube closure; negative regulation of cell communication; negative regulation of signaling; neural tube formation; embryonic epithelial tube formation; response to L-leucine; chromatin remodeling; actin cytoskeleton organization; negative regulation of cellular catabolic process; small GTPase-mediated signal transduction; glycolytic process; pyridine nucleotide catabolic process; ADP catabolic process; pyridine-containing compound catabolic process; TORC1 signaling; corpus callosum development; membrane protein proteolysis; negative regulation of small molecule metabolic process; regulation of glycolytic process; regulation of nucleotide catabolic process; regulation of purine nucleotide catabolic process","0.570068459219378; 0.570068459219378; 0.570068459219378; 0.680690468415836; 0.680690468415836; 0.680690468415836; 0.680690468415836; 0.680690468415836; 0.680690468415836; 0.680690468415836; 0.6891483019776; 0.767574281375045; 0.928277055163065; 0.928277055163065; 0.928277055163065; 0.999963143771498; 0.999963143771498; 0.999963143771498; 0.999963143771498; 0.999963143771498; 0.999963143771498; 0.999963143771498; 0.999963143771498; 0.999963143771498; 0.999963143771498; 0.999963143771498; 0.999963143771498; 0.999963143771498; 0.999963143771498; 0.999963143771498"
"brown","herv_ERVL; herv_HERVK; herv_HERVL; herv_HERVI; herv_ERV3; herv_HERVW; herv_HERVH; herv_ERV1; herv_HERVP; herv_HERVS; AD_binary; herv_HERVF; herv_HERVE","0.144; 0.116; 0.11; 0.105; 0.097; 0.08; 0.069; 0.048; 0.039; 0.038; 0.028; 0.028; 0.017",71,"ANLN; HSP90AA1; HSPA1A; TLE4; PTGES3; CHORDC1; ADIPOR2; ARGLU1; HP1BP3; FXR1; XPO1; MKLN1; PAPOLA; MBNL1; TMEM59; ADAM10; LIFR; PDK4; CNOT2; PLEKHB1; CDH19; DNAJA1; KCNJ2; CLIP4; ZNF706; SEPTIN8; ST13; UBE2D3; HBP1; TNKS","protein folding; 'de novo' protein folding; chaperone-mediated protein folding; protein maturation; 'de novo' post-translational protein folding; response to temperature stimulus; protein refolding; chaperone cofactor-dependent protein refolding; response to heat; response to unfolded protein; positive regulation of telomere maintenance via telomerase; positive regulation of DNA biosynthetic process; response to topologically incorrect protein; positive regulation of telomere maintenance via telomere lengthening; regulation of telomere maintenance via telomerase; cellular response to heat; regulation of telomere maintenance via telomere lengthening; positive regulation of chromosome organization; RNA-templated DNA biosynthetic process; telomere maintenance via telomerase; protein-containing complex assembly; positive regulation of telomere maintenance; regulation of DNA biosynthetic process; telomere maintenance via telomere lengthening; regulation of protein localization; regulation of cellular localization; non-membrane-bounded organelle assembly; establishment of protein localization to mitochondrion; regulation of cellular response to heat; protein localization to organelle","1.40203324193938e-11; 1.98687610689586e-08; 2.60849922678881e-08; 2.8220864299705e-08; 2.85892586519125e-07; 3.88672115449341e-05; 4.09504445498524e-05; 6.49060858892865e-05; 8.45977142636082e-05; 0.000173985371878052; 0.000197306604122361; 0.000268055607481721; 0.000330207408221431; 0.000330207408221431; 0.00315444626327061; 0.00315444626327061; 0.00529776143875371; 0.00709236263341117; 0.00879489182818538; 0.00879489182818538; 0.00890604838447086; 0.00890604838447086; 0.00890604838447086; 0.0113979080253707; 0.0199201975107324; 0.0221483615481974; 0.0242490443228377; 0.0326219510885322; 0.0378404948156105; 0.0378404948156105"
"green","herv_HERVK; herv_ERVL; herv_HERVI; herv_HERVL; herv_ERV3; herv_HERVW; AD_binary; herv_HERVH; herv_HERVP; herv_ERV1; herv_HERVF; herv_HERVS; herv_HERVE","0.143; 0.14; 0.128; 0.124; 0.118; 0.093; -0.087; 0.086; 0.05; 0.031; 0.029; 0.025; 0.024",58,"PTK2; MOG; OPALIN; BCAS1; SCD5; MOBP; TMEFF2; COL4A5; AKAP6; LPGAT1; LANCL1; TJP1; KLHL32; HECW2; PLLP; ZFYVE16; RBPJ; LPAR1; PHLDB1; SEMA6A; MAL; SCARB2; UBE2E2; PTN; ASTN2; ZDHHC9; PLPPR1; CARNS1; NECAB1; GALNT13","oligodendrocyte differentiation; myelination; ensheathment of neurons; axon ensheathment; regulation of oligodendrocyte differentiation; glial cell differentiation; regulation of sprouting angiogenesis; regulation of anatomical structure morphogenesis; regulation of glial cell differentiation; cell morphogenesis involved in neuron differentiation; oligodendrocyte development; gliogenesis; positive regulation of developmental process; cell adhesion; central nervous system myelination; axon ensheathment in central nervous system; regulation of cell migration; positive regulation of cell migration; locomotion; mesenchymal cell differentiation; positive regulation of cell motility; axon development; regulation of cell motility; positive regulation of locomotion; central nervous system development; regulation of locomotion; neuron development; mesenchyme development; modulation of chemical synaptic transmission; regulation of trans-synaptic signaling","0.00114721527381949; 0.00144946007166206; 0.00144946007166206; 0.00144946007166206; 0.0124401937313227; 0.0325360566100998; 0.0340979921292121; 0.03474346381576; 0.03474346381576; 0.03474346381576; 0.03474346381576; 0.0640877272202379; 0.0848889449379266; 0.0848889449379266; 0.0950315018303285; 0.0950315018303285; 0.0950595776894131; 0.0952693554682378; 0.0952693554682378; 0.0952693554682378; 0.10122092525769; 0.10122092525769; 0.10122092525769; 0.10122092525769; 0.10122092525769; 0.119006206890973; 0.12836306870587; 0.12836306870587; 0.129417648698208; 0.129417648698208"
"black","herv_ERVL; herv_HERVI; herv_HERVL; herv_HERVK; herv_ERV3; herv_HERVW; herv_HERVP; herv_HERVH; herv_HERVS; herv_HERVE; herv_HERVF; herv_ERV1; AD_binary","0.21; 0.197; 0.176; 0.175; 0.162; 0.131; 0.09; 0.074; 0.03; 0.028; 0.025; 0.014; -0.004",33,"RNF220; AGAP1; MAP4K4; FRMD4B; DOCK5; ENPP2; ZNF536; SPOCK1; C10orf90; PRUNE2; DIP2B; LIMCH1; CLMN; DPYD; DLG1; APBB2; ZNF638; GAB1; CDH20; DOCK4; FAM107B; ZSWIM6; GRM3; MAP4K5; CDK19; RYBP; ENOX1; CCNH; CCDC88A; HDAC2-AS2","smooth muscle contraction; positive regulation of epithelial cell migration; cell migration; regulation of epithelial cell migration; cell motility; muscle contraction; regulation of cell-substrate adhesion; regulation of muscle contraction; regulation of smooth muscle contraction; cell junction organization; epithelial cell migration; tissue migration; epithelium migration; positive regulation of smooth muscle cell migration; regulation of vasoconstriction; regulation of vascular associated smooth muscle cell migration; positive regulation of cell migration; vascular associated smooth muscle cell migration; positive regulation of cell motility; positive regulation of locomotion; muscle system process; ribonucleoside monophosphate metabolic process; vasoconstriction; positive regulation of stress fiber assembly; cell-substrate adhesion; regulation of blood circulation; positive regulation of actin filament bundle assembly; neuron differentiation; cell junction assembly; regulation of muscle system process","0.00617523782615222; 0.148980537142173; 0.148980537142173; 0.155818925264083; 0.155818925264083; 0.155818925264083; 0.155818925264083; 0.155818925264083; 0.155818925264083; 0.155818925264083; 0.155818925264083; 0.155818925264083; 0.155818925264083; 0.155818925264083; 0.155818925264083; 0.155818925264083; 0.159945255103539; 0.162959224525678; 0.1655058716681; 0.166379984780968; 0.179504965108642; 0.179504965108642; 0.179504965108642; 0.179504965108642; 0.179504965108642; 0.179504965108642; 0.179504965108642; 0.179504965108642; 0.179504965108642; 0.240005666127042"
"yellow","herv_ERVL; herv_HERVI; herv_HERVK; herv_HERVL; herv_ERV3; herv_HERVW; herv_HERVH; herv_HERVP; AD_binary; herv_HERVF; herv_HERVS; herv_HERVE; herv_ERV1","0.165; 0.146; 0.144; 0.143; 0.117; 0.104; 0.074; 0.059; -0.039; 0.022; 0.021; 0.02; 0.02",61,"IL1RAPL1; QKI; PIP4K2A; PDE4B; PCDH9; CTNNA3; ELMO1; ST18; PHLPP1; SHTN1; EDIL3; SLC44A1; DLG2; FRMD5; ZBTB20; SIK3; MAP7; TMTC2; TCF12; MAGI2; DNM3; SEPTIN7; SLC24A2; MARCHF1; SPOCK3; FRYL; PDE1C; ANK3; PTPRD; TTLL7","actin-mediated cell contraction; cell adhesion; actin filament-based movement; neuron differentiation; regulation of actin filament-based movement; neuron projection development; actin filament-based process; gliogenesis; glial cell differentiation; neuron development; cell motility; regulation of cardiac muscle cell contraction; cytoskeleton organization; cell-cell adhesion via plasma-membrane adhesion molecules; positive regulation of neurogenesis; astrocyte differentiation; axon development; cAMP-mediated signaling; cell morphogenesis; central nervous system myelination; axon ensheathment in central nervous system; regulation of neurogenesis; positive regulation of nervous system development; regulation of postsynapse organization; regulation of amyloid-beta formation; cell junction assembly; cardiac muscle cell contraction; regulation of cardiac muscle contraction; regulation of amyloid precursor protein catabolic process; regulation of dendritic spine morphogenesis","0.00093695192843589; 0.00093695192843589; 0.00564379811380642; 0.00741793944331217; 0.00809215112994185; 0.0345455332452197; 0.0345455332452197; 0.0498703958401478; 0.0604769611134513; 0.0604769611134513; 0.0639883980451469; 0.0733889205469893; 0.0848827944223502; 0.0848827944223502; 0.0848827944223502; 0.0848827944223502; 0.104771395066624; 0.110999414130357; 0.110999414130357; 0.110999414130357; 0.110999414130357; 0.110999414130357; 0.110999414130357; 0.110999414130357; 0.110999414130357; 0.110999414130357; 0.121326358158956; 0.1304927362941; 0.1304927362941; 0.143366583330262"
"red","herv_ERVL; herv_HERVI; herv_HERVK; herv_HERVL; herv_ERV3; herv_HERVW; herv_HERVH; herv_HERVP; AD_binary; herv_ERV1; herv_HERVS; herv_HERVF; herv_HERVE","0.184; 0.148; 0.145; 0.143; 0.138; 0.103; 0.075; 0.07; 0.068; 0.042; 0.04; 0.036; 0.024",50,"SORT1; NEAT1; LINC-PINT; LRRC1; NCOA7; ZNF652; PCGF5; EFHD1; FKBP5; CEDORA; SILC1; MPDZ; HIBCH; KIZ; CPQ; KANSL1L; LINC00862; SSBP2; PNISR; COPA; MAP2K4; ENSG00000285635; PPP4R2; BNIP3L; ADAMTSL3; NDUFAF6; PDS5B; ZNF397; APOLD1; PANTR1","epidermis development; Fc-epsilon receptor signaling pathway; neurotrophin signaling pathway; brain morphogenesis; postreplication repair; regulation of hematopoietic progenitor cell differentiation; cellular response to chemical stress; regulation of membrane permeability; Fc receptor signaling pathway; DNA repair; T cell differentiation in thymus; morphogenesis of an epithelium; hair follicle development; DNA metabolic process; D-glucose import; peripheral nervous system development; molting cycle process; hair cycle process; biomineral tissue development; cellular response to oxidative stress; tissue morphogenesis; molting cycle; hair cycle; skin epidermis development; mRNA export from nucleus; D-glucose transmembrane transport; animal organ morphogenesis; hexose transmembrane transport; endothelial cell differentiation; regulation of lymphocyte proliferation","0.549405238737883; 0.549405238737883; 0.549405238737883; 0.549405238737883; 0.549405238737883; 0.549405238737883; 0.549405238737883; 0.549405238737883; 0.549405238737883; 0.549405238737883; 0.549405238737883; 0.549405238737883; 0.549405238737883; 0.549405238737883; 0.549405238737883; 0.549405238737883; 0.549405238737883; 0.549405238737883; 0.549405238737883; 0.549405238737883; 0.549405238737883; 0.549405238737883; 0.549405238737883; 0.549405238737883; 0.549405238737883; 0.549405238737883; 0.549405238737883; 0.549405238737883; 0.549405238737883; 0.549405238737883"
"pink","herv_HERVK; herv_ERVL; herv_ERV3; herv_HERVI; herv_HERVL; herv_HERVW; herv_HERVH; herv_HERVP; AD_binary; herv_HERVF; herv_HERVE; herv_HERVS; herv_ERV1","0.145; 0.141; 0.136; 0.128; 0.126; 0.099; 0.081; 0.076; -0.055; 0.034; 0.03; 0.025; 0.015",21,"PLEKHH1; PDE8A; ENSG00000227088; FAM13C; ATP10B; ENSG00000226994; PSD3; NAALADL2; LINC01170; LINC03122; DENND5A; LINC01630; RFX3-DT; ITFG1; NEK3; ENSG00000298738; MIR325HG; SUMF1; DPH6; ENSG00000308009; PROX1-AS1","carbohydrate derivative catabolic process; cyclic purine nucleotide metabolic process; cyclic nucleotide metabolic process; sphingolipid catabolic process; ARF protein signal transduction; regulation of ARF protein signal transduction; membrane lipid catabolic process; regulation of tubulin deacetylation; tubulin deacetylation; cellular response to epidermal growth factor stimulus; regulation of protein deacetylation; glycosphingolipid metabolic process; phospholipid translocation; response to epidermal growth factor; cAMP-mediated signaling; lipid translocation; regulation of membrane lipid distribution; protein deacetylation; protein deacylation; macromolecule deacylation; glycolipid metabolic process; phospholipid transport; lysosome organization; positive regulation of ERK1 and ERK2 cascade; lytic vacuole organization; liposaccharide metabolic process; purine ribonucleotide catabolic process; organophosphate ester transport; purine nucleotide catabolic process; ribonucleotide catabolic process","0.196318045710583; 0.196318045710583; 0.196318045710583; 0.196318045710583; 0.196318045710583; 0.196318045710583; 0.196318045710583; 0.196318045710583; 0.196318045710583; 0.196318045710583; 0.196318045710583; 0.196318045710583; 0.196318045710583; 0.196318045710583; 0.196318045710583; 0.196318045710583; 0.196318045710583; 0.196318045710583; 0.219613001195463; 0.219613001195463; 0.219613001195463; 0.219613001195463; 0.219613001195463; 0.219613001195463; 0.219613001195463; 0.219613001195463; 0.261588539647107; 0.261588539647107; 0.261588539647107; 0.261588539647107"
